<?xml version="1.0" encoding="utf-8" ?>
<Component xmlns:xsi="http://www.w3.org/2001/XMLSchema-instance"
           xsi:noNamespaceSchemaLocation="https://raw.githubusercontent.com/sebbouez/ExpressiveWeb/refs/heads/main/Schemas/schema_components.xsd">

    <UID>bootstrap.CardText</UID>
    <Name>Card text</Name>
 
    <Features>
        <InlineEdit/>
    </Features>

    <Actions>
    </Actions>
    
    <Allows>text</Allows>


    <Template>
        <![CDATA[
        <p class="card-text">Some text</p>
        ]]>
    </Template>
    
</Component>