<?xml version="1.0" encoding="utf-8" ?>
<Component xmlns:xsi="http://www.w3.org/2001/XMLSchema-instance"
           xsi:noNamespaceSchemaLocation="https://raw.githubusercontent.com/sebbouez/ExpressiveWeb/refs/heads/main/Schemas/schema_components.xsd">

    <UID>bootstrap.CardTitle</UID>
    <Name>Card title</Name>

    <Features>
        <InlineEdit/>
    </Features>
    
    <Allows>text</Allows>


    <Template>
        <![CDATA[
        <h5 class="card-title">Some text</p>
        ]]>
    </Template>
    
</Component>