<?xml version="1.0" encoding="utf-8" ?>
<Component xmlns:xsi="http://www.w3.org/2001/XMLSchema-instance"
           xsi:noNamespaceSchemaLocation="https://raw.githubusercontent.com/sebbouez/ExpressiveWeb/refs/heads/main/Schemas/schema_components.xsd">

    <UID>bootstrap.Paragraph</UID>
    <Name>Paragraph</Name>
    <Family>paragraphs</Family>
    
    <Features>
        <InlineEdit/>
        <SwapTextTag/>
    </Features>
    
    <Allows>text</Allows>

    <Template>
        <![CDATA[
        <p>Some text</p>
        ]]>
    </Template>
    
</Component>