<?xml version="1.0" encoding="utf-8" ?>
<Component xmlns:xsi="http://www.w3.org/2001/XMLSchema-instance"
           xsi:noNamespaceSchemaLocation="https://raw.githubusercontent.com/sebbouez/ExpressiveWeb/refs/heads/main/Schemas/schema_components.xsd">

    <UID>bootstrap.Col</UID>
    <Name>Col</Name>

    <Actions>
        <Action Header="Add card" Command="AppendChild" Params="bootstrap.Card"/>
        <Action Header="Add heading 1" Command="AppendChild" Params="bootstrap.Heading1"/>
        <Action Header="Add heading 2" Command="AppendChild" Params="bootstrap.Heading2"/>
        <Action Header="Add heading 3" Command="AppendChild" Params="bootstrap.Heading3"/>
        <Action Header="Add paragraph" Command="AppendChild" Params="bootstrap.Paragraph"/>
    </Actions>

    <Allows>bootstrap.Card;paragraphs;headings</Allows>

    <Template>
        <![CDATA[
        <div class="col">
            <slot/>
        </div>
        ]]>
    </Template>

</Component>